{"allowed_actions":["modify_code","read_authorized_evidence","run_tests"],"assertion_id":"execution-synthetic-001","build_id":"build-ios-synthetic-031","build_identity_digest":"sha256:f64af91f8587624ef1f7be29e7651a44b82e86f922ee4bc15c3105f9d467550b","consumer":{"agent":"openai_codex","instance_id":"codex-task-synthetic-001","kind":"execution_agent","runtime_profile":{"authentication_scope":"single_invocation","command":"codex_exec","ephemeral":true,"network_access":false,"non_interactive":true,"sandbox":"workspace-write","structured_output":true}},"contract_version":"tacua.execution-assertion@1.0.0","current_handoff_digest":"sha256:0c0db4a908a371bb925440d5a3d8680ca9c8f544b93743cc416dc5a8786b1e21","evidence_item_digests":[{"evidence_id":"evidence-backend-001","evidence_item_digest":"sha256:b703d8bcc07247e8f3c98ae64a0a04b344538b934e210d4c579def4a45ae285b"},{"evidence_id":"evidence-keyframe-001","evidence_item_digest":"sha256:f4e4427f4ef61ed33700b9f5874be68e5df6452f42e585ff719fffe5fc5be843"},{"evidence_id":"evidence-repository-001","evidence_item_digest":"sha256:147956c3559a97a6b6dba078b41bb06e85cd4d917b0fe8ce2733c2df4709f231"},{"evidence_id":"evidence-route-001","evidence_item_digest":"sha256:e6b5eba909829a62c973a0e32d9f1a56340eeb2a5281bce40ee3dde1e31d3680"},{"evidence_id":"evidence-sentry-001","evidence_item_digest":"sha256:c120f94f1ccdf7ea5aad97205d9fc5abc2cb9d8a30f39a8eff0ddd5a4b78042b"},{"evidence_id":"evidence-tap-001","evidence_item_digest":"sha256:56991e60d9660e2be5fc340bfba1f4f5b81c75fd6a19e938f2a4785cfc9ce55e"}],"evidence_manifest_digest":"sha256:43483eaf0a5a55a120c9cfee704ebfbafd3db95dd89d8e6ff5ff8ca320d38f0f","expires_at":"2026-07-20T11:14:00Z","issued_at":"2026-07-20T10:59:00Z","issuer_id":"execution-issuer-synthetic","media_type":"application/vnd.tacua.execution-assertion+json;version=1.0.0","nonce":"c3ludGhldGljLWV4ZWN1dGlvbi0wMDE","organization_id":"org-synthetic","project_id":"project-sample-mobile-app-synthetic","repositories":[{"repository_id":"repo-sample-backend","revision":"89abcdef0123456789abcdef0123456789abcdef"},{"repository_id":"repo-sample-mobile-app","revision":"0123456789abcdef0123456789abcdef01234567"}],"revocation_list_id":"execution-revocations-synthetic","revocation_revision":"revocation-revision-synthetic-001","signature":{"algorithm":"hmac-sha256","key_id":"execution-key-synthetic-001","value":"hmac-sha256:a4b1fa2fd2767e0b2284e130c1f27d559c11b3aa9ff609d570e658f63dce59e7"},"ticket_id":"ticket-synthetic-001","ticket_version":4}
